{
  "$schema": "http://json-schema.org/draft-07/schema#",
  "$id": "https://dev.dsh.watch/protocol/character-pack.schema.json",
  "title": "character-pack",
  "description": "Versioned role-based character pack (schema v2, contributor B owns). Required roles: idle (>=3 clips), work (enter/loop/exit [enter, loop, exit]), neutral_hold (single-clip hold). Optional roles (listen, talk, work_talk, celebrate, question) resolve through fallback_role, ultimately idle. Ownership invariant: question/work_talk actions must be state-owned (model_selectable=false). Asset refs must be bare filenames (no directories, no traversal). License allowlist for public ship is explicit (cleared originals: CC0-1.0 hand-authored vectors and Apache-2.0 owner-approved original Cappi pack); UNRESOLVED/unknown licenses are local-parity-only. Supersedes the draft v0 roles-to-clip-lists shape; v1 Cappi manifests migrate via migrateLegacyManifest to the canonical cappi-original pack with the same role assignments.",
  "type": "object",
  "required": ["schema_version", "pack", "version", "author", "license", "dimensions", "actions", "clips", "roles", "fallback_role"],
  "properties": {
    "schema_version": { "type": "number", "const": 2 },
    "pack": {
      "type": "string",
      "description": "Stable pack id: lowercase alphanumerics plus . _ -",
      "pattern": "^[a-z0-9][a-z0-9._-]*$"
    },
    "version": { "type": "string", "minLength": 1, "maxLength": 64 },
    "author": { "type": "string", "minLength": 1 },
    "attribution": { "type": "string" },
    "license": {
      "type": "string",
      "minLength": 1,
      "description": "Explicit clearance statement. Only allowlisted original licenses (CC0-1.0 hand-authored vectors, Apache-2.0 owner-approved original Cappi pack) ship publicly; values starting with UNRESOLVED — and any other uncleared string — mark local-parity-only packs that must never ship publicly."
    },
    "dimensions": {
      "type": "object",
      "required": ["width", "height"],
      "properties": {
        "width": { "type": "number", "minimum": 16, "maximum": 1024 },
        "height": { "type": "number", "minimum": 16, "maximum": 1024 }
      }
    },
    "background": { "type": "string" },
    "actions": {
      "type": "array",
      "minItems": 1,
      "items": {
        "type": "object",
        "required": ["id", "mode", "clips"],
        "properties": {
          "id": { "type": "string", "pattern": "^[A-Za-z0-9][A-Za-z0-9_-]*$" },
          "mode": { "type": "string", "enum": ["once", "neutral_loop", "enter_loop_exit", "hold"] },
          "clips": {
            "type": "array",
            "minItems": 1,
            "items": { "type": "string", "pattern": "^[A-Za-z0-9][A-Za-z0-9._-]*\\.(gif|xml|png|webp)$" }
          },
          "model_selectable": { "type": "boolean" },
          "notes": { "type": "string" }
        }
      }
    },
    "clips": {
      "type": "object",
      "minProperties": 1,
      "additionalProperties": {
        "type": "object",
        "required": ["width", "height"],
        "properties": {
          "width": { "type": "number" },
          "height": { "type": "number" },
          "duration_s": { "type": "number" }
        }
      }
    },
    "roles": {
      "type": "object",
      "required": ["idle", "work", "neutral_hold"],
      "description": "Required: idle (>=3 clips), work (enter/loop/exit), neutral_hold (hold). Optional (fallback through fallback_role to idle): listen, talk, work_talk, celebrate, question.",
      "properties": {
        "idle": { "$ref": "#/definitions/actionRefList" },
        "listen": { "$ref": "#/definitions/actionRefList" },
        "talk": { "$ref": "#/definitions/actionRefList" },
        "work": { "$ref": "#/definitions/actionRefList" },
        "work_talk": { "$ref": "#/definitions/actionRefList" },
        "celebrate": { "$ref": "#/definitions/actionRefList" },
        "question": { "$ref": "#/definitions/actionRefList" },
        "neutral_hold": { "$ref": "#/definitions/actionRefList" }
      },
      "additionalProperties": false
    },
    "fallback_role": {
      "type": "string",
      "enum": ["idle", "listen", "talk", "work", "work_talk", "celebrate", "question", "neutral_hold"]
    },
    "transitions": {
      "type": "object",
      "description": "Optional explicit graph override: action id -> action id. Both ends must be declared actions.",
      "additionalProperties": { "type": "string" }
    },
    "notes": { "type": "string" }
  },
  "definitions": {
    "actionRefList": {
      "type": "array",
      "minItems": 1,
      "items": { "type": "string" }
    }
  }
}
